{
  "$schema": "http://json-schema.org/draft-07/schema#",
  "title": "Portfolio Config",
  "type": "object",
  "properties": {
    "personalInfo": {
      "type": "object",
      "properties": {
        "name": { "type": "string", "minLength": 1 },
        "title": { "type": "string", "minLength": 1 },
        "mediumProfile": { "type": "string" },
        "githubProfile": { "type": "string" },
        "updatedLabel": { "type": "string" },
        "defaultTheme": { "type": "string", "enum": ["light", "dark"] }
      },
      "required": ["name", "title"],
      "additionalProperties": false
    },

    "about": {
      "type": "object",
      "properties": {
        "tagline": { "type": "string", "minLength": 1 },
        "bio": { "type": "string", "minLength": 1 },
        "photo": { "$ref": "#/definitions/imageRef" },
        "cta": {
          "type": "object",
          "properties": {
            "label": { "type": "string", "minLength": 1 },
            "url": { "type": "string" }
          },
          "required": ["label", "url"],
          "additionalProperties": false
        },
        "personJSONLD": { "type": "boolean", "default": true }
      },
      "required": ["tagline", "bio", "photo"],
      "additionalProperties": false
    },

    "navigation": {
      "type": "array",
      "items": {
        "type": "object",
        "properties": {
          "label": { "type": "string", "minLength": 1 },
          "href": { "type": "string" }
        },
        "required": ["label", "href"],
        "additionalProperties": false
      }
    },

    "sidebar": {
      "type": "object",
      "properties": {
        "updates": {
          "type": "array",
          "items": {
            "type": "object",
            "properties": {
              "date": { "type": "string" },
              "text": { "type": "string" }
            },
            "required": ["date", "text"],
            "additionalProperties": false
          }
        },
        "skillsSections": {
          "type": "array",
          "items": {
            "type": "object",
            "properties": {
              "title": { "type": "string" },
              "items": { "type": "array", "items": { "type": "string" } }
            },
            "required": ["title", "items"],
            "additionalProperties": false
          }
        },
        "quickLinks": {
          "type": "array",
          "items": {
            "type": "object",
            "properties": {
              "label": { "type": "string" },
              "url": { "type": "string" }
            },
            "required": ["label", "url"],
            "additionalProperties": false
          }
        }
      },
      "required": ["updates", "skillsSections", "quickLinks"],
      "additionalProperties": false
    },

    "projects": {
      "type": "array",
      "items": { "$ref": "#/definitions/project" }
    },

    "openSource": {
      "type": "array",
      "items": { "$ref": "#/definitions/openSourceItem" }
    },

    "academics": {
      "type": "object",
      "properties": {
        "education": { "type": "array", "items": { "$ref": "#/definitions/educationItem" } },
        "exams": { "type": "array", "items": { "$ref": "#/definitions/examItem" } },
        "internships": { "type": "array", "items": { "$ref": "#/definitions/internshipItem" } }
      },
      "required": ["education", "exams", "internships"],
      "additionalProperties": false
    },

    "blog": {
      "type": "object",
      "properties": {
        "showOnHomepage": { "type": "boolean" },
        "mode": { "type": "string", "enum": ["manual", "feed"] },
        "cacheMinutes": { "type": "integer", "minimum": 1 },
        "manualPosts": {
          "type": "array",
          "items": { "$ref": "#/definitions/blogManualPost" }
        },
        "normalized": {
          "type": "array",
          "description": "Server-filled cache derived from manualPosts",
          "items": { "$ref": "#/definitions/blogNormalizedPost" }
        },
        "taxonomy": { "$ref": "#/definitions/blogTaxonomy" }
      },
      "required": ["mode", "manualPosts"],
      "additionalProperties": false
    },

    "settings": {
      "type": "object",
      "properties": {
        "accessibility": {
          "type": "object",
          "properties": {
            "skipLinkLabel": { "type": "string", "default": "Skip to content" },
            "forceFocusVisible": { "type": "boolean", "default": true },
            "minContrastAA": { "type": "boolean", "default": true },
            "requireCaptions": { "type": "boolean", "default": false }
          },
          "additionalProperties": false
        },
        "performance": {
          "type": "object",
          "properties": {
            "lazyLoadImagesDefault": { "type": "boolean", "default": true },
            "responsiveImagesDefault": { "type": "boolean", "default": true },
            "maxImageWidth": { "type": "integer", "minimum": 320, "default": 2560 },
            "deferNonCriticalJS": { "type": "boolean", "default": true }
          },
          "additionalProperties": false
        }
      },
      "required": ["accessibility", "performance"],
      "additionalProperties": false
    }
  },

  "required": ["personalInfo", "projects"],
  "additionalProperties": false,

  "definitions": {
    "imageRef": {
      "type": "object",
      "properties": {
        "src": { "type": "string" },
        "alt": { "type": "string" }
      },
      "required": ["src", "alt"],
      "additionalProperties": false
    },

    "thumbnailRef": {
      "type": "object",
      "properties": {
        "src": { "type": "string" },
        "fullSrc": { "type": "string" },
        "alt": { "type": "string" }
      },
      "required": ["src", "fullSrc"],
      "additionalProperties": false
    },

    "mediaTab": {
      "type": "object",
      "properties": {
        "id": { "type": "string", "minLength": 1 },
        "label": { "type": "string", "minLength": 1 },
        "type": { "type": "string", "enum": ["video", "gallery", "diagram"] },
        "content": { "type": "object" }
      },
      "required": ["id", "label", "type", "content"],
      "additionalProperties": false,
      "allOf": [
        {
          "if": { "properties": { "type": { "const": "video" } } },
          "then": {
            "properties": {
              "content": {
                "type": "object",
                "properties": {
                  "videoId": { "type": "string", "minLength": 1 },
                  "placeholder": { "type": "string" }
                },
                "required": ["videoId"],
                "additionalProperties": false
              }
            }
          }
        },
        {
          "if": { "properties": { "type": { "const": "gallery" } } },
          "then": {
            "properties": {
              "content": {
                "type": "object",
                "properties": {
                  "mainImage": { "$ref": "#/definitions/imageRef" },
                  "thumbnails": {
                    "type": "array",
                    "items": { "$ref": "#/definitions/thumbnailRef" },
                    "minItems": 1
                  }
                },
                "required": ["mainImage", "thumbnails"],
                "additionalProperties": false
              }
            }
          }
        },
        {
          "if": { "properties": { "type": { "const": "diagram" } } },
          "then": {
            "properties": {
              "content": {
                "type": "object",
                "properties": {
                  "src": { "type": "string", "minLength": 1 },
                  "alt": { "type": "string" },
                  "caption": { "type": "string" }
                },
                "required": ["src"],
                "additionalProperties": false
              }
            }
          }
        }
      ]
    },

    "techSpecs": {
      "type": "object",
      "properties": {
        "title": { "type": "string" },
        "items": { "type": "array", "items": { "type": "string" } }
      },
      "required": ["title", "items"],
      "additionalProperties": false
    },

    "projectLinks": {
      "type": "object",
      "properties": {
        "github": { "type": "string" },
        "demo": { "type": "string" },
        "paper": { "type": "string" },
        "website": { "type": "string" }
      },
      "additionalProperties": { "type": "string" }
    },

    "caseStudy": {
      "type": "object",
      "properties": {
        "role": { "type": "string" },
        "responsibilities": { "type": "array", "items": { "type": "string" } },
        "problem": { "type": "string" },
        "approach": { "type": "string" },
        "impact": { "type": "string" },
        "outcomes": { "type": "array", "items": { "type": "string" } }
      },
      "additionalProperties": false
    },

    "project": {
      "type": "object",
      "properties": {
        "id": { "type": "string", "minLength": 1, "pattern": "^[a-zA-Z0-9-_]+$" },
        "title": { "type": "string", "minLength": 1 },
        "meta": {
          "type": "object",
          "properties": {
            "category": { "type": "string" },
            "status": { "type": "string" },
            "date": { "type": "string" }
          },
          "required": ["category", "status", "date"],
          "additionalProperties": false
        },
        "summary": { "type": "string" },
        "featured": { "type": "boolean" },
        "media": {
          "type": "object",
          "properties": {
            "tabs": { "type": "array", "items": { "$ref": "#/definitions/mediaTab" }, "minItems": 1 }
          },
          "required": ["tabs"],
          "additionalProperties": false
        },
        "techSpecs": { "$ref": "#/definitions/techSpecs" },
        "content": { "type": "array", "items": { "type": "string" }, "minItems": 1 },
        "links": { "$ref": "#/definitions/projectLinks" },
        "caseStudy": { "$ref": "#/definitions/caseStudy" }
      },
      "required": ["id", "title", "meta", "summary", "content"],
      "additionalProperties": false
    },

    "openSourceItem": {
      "type": "object",
      "properties": {
        "name": { "type": "string", "minLength": 1 },
        "blurb": { "type": "string" },
        "repoUrl": { "type": "string" },
        "demoUrl": { "type": "string" },
        "license": { "type": "string" },
        "goodFirstIssuesUrl": { "type": "string" },
        "tags": { "type": "array", "items": { "type": "string" } }
      },
      "required": ["name", "repoUrl"],
      "additionalProperties": false
    },

    "educationItem": {
      "type": "object",
      "properties": {
        "level": { "type": "string", "enum": ["secondary", "higherSecondary", "bachelors", "masters"] },
        "institution": { "type": "string" },
        "board": { "type": "string" },
        "location": { "type": "string" },
        "start": { "type": "string" },
        "end": { "type": "string" },
        "grade": { "type": "string" },
        "honors": { "type": "string" },
        "coursework": { "type": "array", "items": { "type": "string" } }
      },
      "required": ["level", "institution"],
      "additionalProperties": false
    },

    "examItem": {
      "type": "object",
      "properties": {
        "name": { "type": "string" },
        "subject": { "type": "string" },
        "authority": { "type": "string" },
        "year": { "type": "string" },
        "score": { "type": "string" },
        "percentile": { "type": "string" },
        "rank": { "type": "string" },
        "certificateUrl": { "type": "string" }
      },
      "required": ["name", "year"],
      "additionalProperties": false
    },

    "internshipItem": {
      "type": "object",
      "properties": {
        "org": { "type": "string" },
        "title": { "type": "string" },
        "team": { "type": "string" },
        "location": { "type": "string" },
        "start": { "type": "string" },
        "end": { "type": "string" },
        "proofUrl": { "type": "string" },
        "contact": { "type": "string" },
        "bullets": { "type": "array", "items": { "type": "string" } },
        "tech": { "type": "array", "items": { "type": "string" } }
      },
      "required": ["org", "title", "start"],
      "additionalProperties": false
    },

    "blogSeries": {
      "type": "object",
      "properties": {
        "id": { "type": "string", "minLength": 1 },
        "title": { "type": "string", "minLength": 1 },
        "items": { "type": "array", "items": { "type": "string" }, "minItems": 1 }
      },
      "required": ["id", "title", "items"],
      "additionalProperties": false
    },

    "blogTaxonomy": {
      "type": "object",
      "properties": {
        "categories": { "type": "array", "items": { "type": "string" } },
        "tagSuggestions": { "type": "array", "items": { "type": "string" } },
        "series": { "type": "array", "items": { "$ref": "#/definitions/blogSeries" } }
      },
      "additionalProperties": false
    },

    "blogManualPost": {
      "type": "object",
      "properties": {
        "url": { "type": "string", "minLength": 1 },
        "category": { "type": "string" },
        "pinned": { "type": "boolean" },
        "overrides": {
          "type": "object",
          "properties": {
            "title": { "type": "string" },
            "summary": { "type": "string" },
            "image": { "type": "string" },
            "date": { "type": "string" }
          },
          "additionalProperties": false
        }
      },
      "required": ["url"],
      "additionalProperties": false
    },

    "blogNormalizedPost": {
      "type": "object",
      "properties": {
        "url": { "type": "string" },
        "title": { "type": "string" },
        "summary": { "type": "string" },
        "image": { "type": "string" },
        "date": { "type": "string" },
        "readMinutes": { "type": "integer", "minimum": 1 },
        "tags": { "type": "array", "items": { "type": "string" } },
        "category": { "type": "string" },
        "pinned": { "type": "boolean" },
        "series": { "type": "array", "items": { "type": "string" } }
      },
      "required": ["url", "title"],
      "additionalProperties": false
    }
  }
}
